{"$schema":"./free-models.schema.json","generatedAt":"2026-09-20T18:43:55.643Z","source":"https://opencode.ai/docs/zen","count":8,"defaultModel":"muse-spark-1.2-contributor-free","opencodeVersion":"1.18.31","models":[{"id":"jev-1.13-free","name":"Jev 1.13 Free","api":"openai-completions","reasoning":false,"input":["text"],"cost":{"input":0,"output":0,"cacheRead":0,"cacheWrite":0},"contextWindow":128000,"maxTokens":8192,"compat":{"maxTokensField":"max_tokens","supportsStore":false,"supportsReasoningEffort":false,"supportsDeveloperRole":false,"supportsUsageInStreaming":false}},{"id":"big-pickle","name":"Big Pickle","api":"openai-completions","reasoning":true,"input":["text"],"cost":{"input":0,"output":0,"cacheRead":0,"cacheWrite":0},"contextWindow":200000,"maxTokens":32000,"compat":{"maxTokensField":"max_tokens","supportsStore":false,"supportsReasoningEffort":true,"supportsDeveloperRole":false,"supportsUsageInStreaming":false,"requiresReasoningContentOnAssistantMessages":true}},{"id":"mimo-v2.5-free","name":"MiMo V2.5 Free","api":"openai-completions","reasoning":true,"input":["text","image"],"cost":{"input":0,"output":0,"cacheRead":0,"cacheWrite":0},"contextWindow":200000,"maxTokens":32000,"compat":{"maxTokensField":"max_tokens","supportsStore":false,"supportsReasoningEffort":true,"supportsDeveloperRole":false,"supportsUsageInStreaming":false,"requiresReasoningContentOnAssistantMessages":true}},{"id":"ling-3.0-flash-fin-free","name":"Ling 3.0 Flash Fin Free","api":"openai-completions","reasoning":true,"input":["text"],"cost":{"input":0,"output":0,"cacheRead":0,"cacheWrite":0},"contextWindow":262144,"maxTokens":32768,"compat":{"maxTokensField":"max_tokens","supportsStore":false,"supportsReasoningEffort":true,"supportsDeveloperRole":false,"supportsUsageInStreaming":false}},{"id":"nemotron-3-ultra-free","name":"Nemotron 3 Ultra Free","api":"openai-completions","reasoning":true,"input":["text"],"cost":{"input":0,"output":0,"cacheRead":0,"cacheWrite":0},"contextWindow":1000000,"maxTokens":128000,"compat":{"maxTokensField":"max_tokens","supportsStore":false,"supportsReasoningEffort":true,"supportsDeveloperRole":false,"supportsUsageInStreaming":false,"requiresReasoningContentOnAssistantMessages":true}},{"id":"nemotron-3.5-lightning-free","name":"Nemotron 3.5 Lightning Free","api":"openai-completions","reasoning":true,"input":["text"],"cost":{"input":0,"output":0,"cacheRead":0,"cacheWrite":0},"contextWindow":262144,"maxTokens":262144,"compat":{"maxTokensField":"max_tokens","supportsStore":false,"supportsReasoningEffort":true,"supportsDeveloperRole":false,"supportsUsageInStreaming":false,"requiresReasoningContentOnAssistantMessages":true}},{"id":"muse-spark-1.3-contributor-free","name":"Muse Spark 1.3 Free","api":"openai-responses","reasoning":true,"thinkingLevelMap":{"off":null,"minimal":"minimal","low":"low","medium":"medium","high":"high","xhigh":"xhigh","max":null},"input":["text","image"],"cost":{"input":0,"output":0,"cacheRead":0,"cacheWrite":0},"contextWindow":1048576,"maxTokens":131072,"compat":{}},{"id":"muse-spark-1.2-contributor-free","name":"Muse Spark 1.2 Free","api":"openai-responses","reasoning":true,"thinkingLevelMap":{"off":null,"minimal":"minimal","low":"low","medium":"medium","high":"high","xhigh":"xhigh","max":null},"input":["text","image"],"cost":{"input":0,"output":0,"cacheRead":0,"cacheWrite":0},"contextWindow":1048576,"maxTokens":131072,"compat":{}}]}
